Sr.No,"School Code","School Name",City,Address,"STD Code","Phone Nos","Principal Name",State,Pincode,"Co-ordinator1 Name","Co-ordinator1 Contact No.","Co-ordinator1 Email"
1,147,"Nath Valley School",Aurangabad,"P O Box 567, Cantonment Post Office, Satara Village, Paithan Road, ",0240,"2379247, 2379176, 2379272","Mr. Ranjit K Dass",Maharashtra,431002,"Mrs. Shailaja Khadse",9960792266,shailajakhadse@gmail.com
2,2672,"Delhi Public School",Jodhpur,"Near Bypass Road, Pal Village, ",0291,"2766887,2766888,2766401,2766402","Mr. B. S. Yadav",Rajasthan,342001,"Sachin Kumar",9414701993,sachin@dpsjodhpur.in
3,3033,"Bluebells School International","New Delhi","Opposite Lady Shriram College, Kailash Colony, ",011,"29232963, 29235679","Mrs. Suman Kumar",Delhi,110048,"Ms. Nandita S. Roy",9811724811,nandita.roy@blubellsinternational.com
4,3622,"Amity International School, Saket","New Delhi","Road No.44, M-Block, Saket, ",011,"29562583, 29561606, 2953098","Ms Divya Bhatia",Delhi,110017,"Mamta Gupta",9899038616,guptamamta1976@gmail.com
5,4899,"The Sudarshan Vidya Mandir ICSE Academy",Bangalore,"1164, 26th ^A^ Main, 4th ^T^ Block, Jayanagar, ",080,"26640330, 26646221, 26641982","Ms. Geetha Ramesh",Karnataka,560041,"Ms. Moushumi",,moushomidutta@yahoo.co.in
