Sr.No,"School Code","School Name",City,Address,"STD Code","Phone Nos","Principal Name",State,Pincode,"Co-ordinator1 Name","Co-ordinator1 Contact No.","Co-ordinator1 Email"
1,10316,"Mahadevi Birla World Academy",Kolkata,"17 A, Darga Road, Park Circus ",033,"22873613, 22873913","Ms. Anjana Saha","West Bengal",700017,"Mrs Joyita  Kundu",9433899453,jayita@presidency.com
2,401318,"National English School",Kolkata,"V I P Road, Baguihati, Besides Big Bazar, ",033,25701447,"Ms. Moushumi Saha","West Bengal",700059,,,
3,495578,"St. Xavier^s School",Hazaribag,"Near District Chowk, Post Box - 19, ",0654,"222334, 8986891646","Fr Rossner",Jharkhand,825301,"Dr. Debabrata Mitra",7091594818,dmitra4@gmail.com
4,667880,"Bidya Bharati School, Mominpore",Kolkata,"44/2, Diamond Harbour Road, P.O. Mominpore, Nr. Mominpur Junction",033,"24491009,24457135","Mrs. Anjana Mallick","West Bengal",700027,"Ms.Mahua Ganguly",9088825848,mahuaganguly28011977@gmail.com
5,673276,"The Pentecostal Assembly School",Bokaro,"Sector 12 B, Near  Telephone Exchange, Bokaro Steel City, ",0653,"256777, 281093, 256500","Mrs. Rita Prasad",Jharkhand,827012,"Mr. Mohan Kumar Mishra",9304789909,mohansir.pas@gmail.com
6,3147043,"Delhi Public School ",Durgapur,"Plot No. 2D/10, Sector 2D, Bidhannagar, ",0343,"2002816, 99030 29462","Mrs. Abbak Chatterjee","West Bengal",713212,"KANIKA NATH",9474882721,kanikanath.69@gmail.com
7,3197319,"Adamas World School, Barasat",Barasat,"ADAMAS KNOWLEDGE CITY  Barasat - Barrackpore Road, P.O. - Jagannathpur, District - 24 Parganas (North), Kolkata",033,"64500503,7890019478","Ms.Moushumi Banerjee","West Bengal",700126,"Ms.Mahua Goswami",9674680699,mahuagoswami77@gmail.com
8,3495816,"Young Horizons School, campus II",Kolkata,"100 B, Karaya Road  Kolkata ",033,22901220,"Ms.Sangeeta Sen","West Bengal",700019,"Jhuma Ganguly",,8420892390
